id,name,description,is_archived
49ac4711-e71c-4426-8fd1-c13643e7a265,dolorem illo totam,eaque harum odio explicabo commodi,false
d0479c65-f200-4afc-91c6-63407250b6c1,dolore et fuga,esse distinctio et dolor quia,false
98d8edb7-130f-4215-997a-37ed02a8dc6d,et ut nulla,facere et eum debitis eos,false
8ee3ee29-368e-4cdc-a545-1949098503ff,vel quisquam labore,aspernatur cumque quisquam ipsum enim,false
b3e70892-997b-40ae-a0f5-aa99e9cdd12c,odit assumenda sapiente,molestiae consectetur rerum voluptatem velit,false
