a61907c4-1911-4e9a-8f76-8f8716d0170c, vero dolore at, PaleTurquoise, qui animi laboriosam iste voluptas, d9c57d9d-60fb-497e-aa99-91ec076cc9c1, 6135a170-f492-4e45-8d2d-e5b5b03f0d56
8eca4aec-86e4-4c2b-b97e-25b04fdbc010, impedit animi et, PowderBlue, ut non aliquam optio voluptas, d9c57d9d-60fb-497e-aa99-91ec076cc9c1, 6135a170-f492-4e45-8d2d-e5b5b03f0d56
fea8f8d4-7e9f-4bd8-8846-43520874a45d, alias fugit est, DarkCyan, cum blanditiis a sit dolores, d9c57d9d-60fb-497e-aa99-91ec076cc9c1, 6135a170-f492-4e45-8d2d-e5b5b03f0d56
020d3525-af16-4c25-ac76-37e08581f3ef, est aut totam, Gainsboro, omnis velit laboriosam sunt cumque, d9c57d9d-60fb-497e-aa99-91ec076cc9c1, 6135a170-f492-4e45-8d2d-e5b5b03f0d56
505116ef-f5de-4571-a0bc-c58a9a1e6190, architecto et et, LavenderBlush, unde reiciendis dicta ea beatae, d9c57d9d-60fb-497e-aa99-91ec076cc9c1, 6135a170-f492-4e45-8d2d-e5b5b03f0d56
75058048-c922-43db-aec9-414ac8482e77, corrupti fugit et, NavajoWhite, rerum qui ut officiis vel, d9c57d9d-60fb-497e-aa99-91ec076cc9c1, 430c8548-a56d-4c97-b801-baba93dcc266
d3bd3193-6d47-4e55-86e2-a468b86ad646, magni incidunt nesciunt, Gold, hic delectus cumque facilis eos, d9c57d9d-60fb-497e-aa99-91ec076cc9c1, 430c8548-a56d-4c97-b801-baba93dcc266
72ce0cc0-d618-4bfa-819f-2342de0930f6, a consequuntur laudantium, DarkTurquoise, facilis quae qui rerum in, d9c57d9d-60fb-497e-aa99-91ec076cc9c1, 430c8548-a56d-4c97-b801-baba93dcc266
88be8b82-e9e7-4d74-9be7-d6fae025d63d, tempore beatae sunt, PaleVioletRed, nemo numquam aut est qui, d9c57d9d-60fb-497e-aa99-91ec076cc9c1, 430c8548-a56d-4c97-b801-baba93dcc266
3410635f-fcb8-43d8-aa96-9eff812215e0, ullam explicabo vel, DarkMagenta, sequi maxime officia amet placeat, d9c57d9d-60fb-497e-aa99-91ec076cc9c1, 430c8548-a56d-4c97-b801-baba93dcc266
ffe80198-134e-4e41-8508-963d35b98f50, quasi quidem sed, Black, magnam rerum quis itaque dolores, d9c57d9d-60fb-497e-aa99-91ec076cc9c1, ce5042e0-8b2d-4c14-96d0-75266492bac5
38bdb21a-86e1-4999-a424-98314afc1001, occaecati velit inventore, LemonChiffon, quis amet vitae possimus natus, d9c57d9d-60fb-497e-aa99-91ec076cc9c1, ce5042e0-8b2d-4c14-96d0-75266492bac5
cea1e8b1-d693-4ac8-ad75-7975e5723ca6, cupiditate quia nesciunt, Turquoise, nisi aut numquam sit dolores, d9c57d9d-60fb-497e-aa99-91ec076cc9c1, ce5042e0-8b2d-4c14-96d0-75266492bac5
5ab2f5e1-b70c-4f12-b2fe-f96873282afd, dolorem mollitia accusamus, Olive, itaque cupiditate assumenda molestiae sed, d9c57d9d-60fb-497e-aa99-91ec076cc9c1, ce5042e0-8b2d-4c14-96d0-75266492bac5
87733f25-f2bd-4439-b6b0-2aa195509dc0, vel quam numquam, DarkViolet, eos sapiente dolores ipsum sapiente, d9c57d9d-60fb-497e-aa99-91ec076cc9c1, ce5042e0-8b2d-4c14-96d0-75266492bac5
38a9e78a-59b1-4437-916c-6b3500ba7c6a, iure labore voluptas, DarkGreen, quia et officia qui temporibus, d9c57d9d-60fb-497e-aa99-91ec076cc9c1, 99767e9e-5998-48ad-b083-68e6085e5d55
7ff8cb98-9342-4912-96e0-c5e0ba5792b7, earum est qui, PaleGreen, quas perferendis repellat culpa aut, d9c57d9d-60fb-497e-aa99-91ec076cc9c1, 99767e9e-5998-48ad-b083-68e6085e5d55
b89c4182-d441-4c34-b27b-531d5837c4a8, iusto numquam qui, MediumVioletRed, repellendus repellendus dolores alias ipsam, d9c57d9d-60fb-497e-aa99-91ec076cc9c1, 99767e9e-5998-48ad-b083-68e6085e5d55
cebfc0a7-fec3-4806-9978-ecf0a2bb4fa5, sit tenetur atque, Crimson, a laudantium dolorem itaque ea, d9c57d9d-60fb-497e-aa99-91ec076cc9c1, 99767e9e-5998-48ad-b083-68e6085e5d55
8a4e2ebe-2236-4c5e-8403-56425b0f9024, dolorem enim rem, Orange, asperiores omnis illo ipsam ea, d9c57d9d-60fb-497e-aa99-91ec076cc9c1, 99767e9e-5998-48ad-b083-68e6085e5d55
4dddb98d-e66f-491b-b207-3ddca745b82d, minus et aperiam, Beige, tempore sequi vitae amet ut, d9c57d9d-60fb-497e-aa99-91ec076cc9c1, 6d39af3e-6048-473e-8e77-4aeef9cd647b
baad0c25-c3ee-4da1-9787-475d245f7794, enim sapiente hic, SteelBlue, repellendus qui laboriosam rerum cupiditate, d9c57d9d-60fb-497e-aa99-91ec076cc9c1, 6d39af3e-6048-473e-8e77-4aeef9cd647b
04def0ea-ed6e-479e-98e4-26dcc34356cd, velit qui aut, Gold, vero vero quam vitae suscipit, d9c57d9d-60fb-497e-aa99-91ec076cc9c1, 6d39af3e-6048-473e-8e77-4aeef9cd647b
67eb0dda-e165-4bcc-8b89-9ef2243e3e26, consequuntur quod deserunt, Silver, ipsa provident magnam officia molestias, d9c57d9d-60fb-497e-aa99-91ec076cc9c1, 6d39af3e-6048-473e-8e77-4aeef9cd647b
45d5826c-87dc-4c78-a729-b36187dc12e2, qui odit ut, PaleTurquoise, necessitatibus qui quo quas corrupti, d9c57d9d-60fb-497e-aa99-91ec076cc9c1, 6d39af3e-6048-473e-8e77-4aeef9cd647b
ac37e93e-1294-414c-b1b3-9dc1bf15c59f, laboriosam ab minima, Darkorange, modi accusamus perspiciatis quisquam est, d9c57d9d-60fb-497e-aa99-91ec076cc9c1, a7851dfc-587a-4a77-aadf-fc3987b50bb9
dce1dbce-0d0c-4deb-8b9b-efa3be3c7db9, optio tenetur sint, Yellow, sint magni ut eum autem, d9c57d9d-60fb-497e-aa99-91ec076cc9c1, a7851dfc-587a-4a77-aadf-fc3987b50bb9
beeddf9e-c2f6-4f00-b4da-37824b5ce472, nemo id optio, ForestGreen, officiis magnam velit fugit velit, d9c57d9d-60fb-497e-aa99-91ec076cc9c1, a7851dfc-587a-4a77-aadf-fc3987b50bb9
820df15e-f9a0-4a5e-990c-35d8f285ebbc, iste officia earum, SlateGray, id quibusdam nisi ea ea, d9c57d9d-60fb-497e-aa99-91ec076cc9c1, a7851dfc-587a-4a77-aadf-fc3987b50bb9
8aebc5bb-29b9-45ab-b0c9-ec11323584d8, veniam autem voluptas, Ivory, consequatur voluptas est molestiae saepe, d9c57d9d-60fb-497e-aa99-91ec076cc9c1, a7851dfc-587a-4a77-aadf-fc3987b50bb9
40b22c2b-a622-4f2f-9568-b38f240c7f1b, saepe velit dolorem, MediumBlue, sed dolores corporis ipsa nostrum, d9c57d9d-60fb-497e-aa99-91ec076cc9c1, 962a5964-8d6a-4fae-8c0c-c04a229c1367
91782810-683a-4a56-b06f-28f1b8e44a09, asperiores deserunt id, GoldenRod, repudiandae optio autem quam est, d9c57d9d-60fb-497e-aa99-91ec076cc9c1, 962a5964-8d6a-4fae-8c0c-c04a229c1367
86460610-6f1d-4b13-ab4a-896b319c7d41, porro et natus, LightBlue, dolorem sint expedita sapiente ducimus, d9c57d9d-60fb-497e-aa99-91ec076cc9c1, 962a5964-8d6a-4fae-8c0c-c04a229c1367
6e875bf7-cd10-40c0-84af-dccc506e378a, molestiae aut omnis, DimGray, sit voluptas esse tempora impedit, d9c57d9d-60fb-497e-aa99-91ec076cc9c1, 962a5964-8d6a-4fae-8c0c-c04a229c1367
7257ecb8-7c15-4abb-8dae-5b12d351cd05, quae illum ut, DarkGreen, soluta odio non asperiores quis, d9c57d9d-60fb-497e-aa99-91ec076cc9c1, 962a5964-8d6a-4fae-8c0c-c04a229c1367
3d8a2775-c4db-465d-8203-b078cf5e0557, ullam consectetur dicta, GoldenRod, odit facere et quo maiores, d9c57d9d-60fb-497e-aa99-91ec076cc9c1, 44f332cc-6e86-4c48-8279-97a96f83ca2a
ab469d03-ac63-414d-b73f-d13f4d035a78, odio rerum enim, MediumAquaMarine, quia odio doloribus inventore qui, d9c57d9d-60fb-497e-aa99-91ec076cc9c1, 44f332cc-6e86-4c48-8279-97a96f83ca2a
2506f740-5262-4f52-90b8-10f450ddd919, reprehenderit quas necessitatibus, LightSteelBlue, sit enim quasi sit cumque, d9c57d9d-60fb-497e-aa99-91ec076cc9c1, 44f332cc-6e86-4c48-8279-97a96f83ca2a
56cef950-2fa2-47fb-8cf7-7841cf135b7c, accusantium maiores voluptas, Violet, quo quaerat quidem voluptas quia, d9c57d9d-60fb-497e-aa99-91ec076cc9c1, 44f332cc-6e86-4c48-8279-97a96f83ca2a
e99e9976-0e7c-4454-8a42-e71ea8350a01, voluptates eos est, LightSeaGreen, qui repellendus non commodi ut, d9c57d9d-60fb-497e-aa99-91ec076cc9c1, 44f332cc-6e86-4c48-8279-97a96f83ca2a
74d7dd7f-38cc-48c2-a346-e00f8808f312, sit et doloremque, OrangeRed, optio rerum omnis commodi aliquid, d9c57d9d-60fb-497e-aa99-91ec076cc9c1, e1796154-4ec3-4db7-8317-64ca8a5fc62f
8b991b3f-141a-425a-8d82-f6f708f6584c, totam fugiat ut, AliceBlue, doloribus nostrum distinctio commodi atque, d9c57d9d-60fb-497e-aa99-91ec076cc9c1, e1796154-4ec3-4db7-8317-64ca8a5fc62f
2dd95ccd-fd67-4177-9ad3-d45639b5ad86, id aut autem, DarkGreen, facere optio eius ipsam et, d9c57d9d-60fb-497e-aa99-91ec076cc9c1, e1796154-4ec3-4db7-8317-64ca8a5fc62f
bb5bb3fc-f09c-4e7b-b3b5-06f4398de3dd, aspernatur possimus libero, Aquamarine, qui ullam eum omnis distinctio, d9c57d9d-60fb-497e-aa99-91ec076cc9c1, e1796154-4ec3-4db7-8317-64ca8a5fc62f
b06182b1-4320-4a82-ae8b-100501227c87, molestiae minima ut, Azure, voluptates qui eum nihil possimus, d9c57d9d-60fb-497e-aa99-91ec076cc9c1, e1796154-4ec3-4db7-8317-64ca8a5fc62f
c45ed3e3-a62f-4566-8d54-a31ebce48908, ut sed corporis, SlateBlue, alias possimus aut qui et, d9c57d9d-60fb-497e-aa99-91ec076cc9c1, e88891cc-aaff-419c-8318-552a1afa3e26
e1e10ae6-70ca-485a-9498-9cf3f795adf4, numquam quod officia, White, delectus doloremque animi voluptatum voluptatem, d9c57d9d-60fb-497e-aa99-91ec076cc9c1, e88891cc-aaff-419c-8318-552a1afa3e26
14b07032-2d59-47ff-9b4c-72ebf2b42fbc, voluptatem eum repellat, PaleTurquoise, dicta consectetur quo sed quasi, d9c57d9d-60fb-497e-aa99-91ec076cc9c1, e88891cc-aaff-419c-8318-552a1afa3e26
3f3a6b23-7b75-4617-aaa4-6277a7fd6990, qui consectetur autem, Darkorange, consequuntur vitae soluta est ut, d9c57d9d-60fb-497e-aa99-91ec076cc9c1, e88891cc-aaff-419c-8318-552a1afa3e26
b89c2357-f2c6-484c-af83-e963b3b5f50d, deserunt molestiae quaerat, Linen, et quis assumenda laboriosam expedita, d9c57d9d-60fb-497e-aa99-91ec076cc9c1, e88891cc-aaff-419c-8318-552a1afa3e26
